{
  "interview_id": "intv_alpha_wh_lead",
  "related_intake_id": "intake_alpha_2026",
  "stakeholder_role": "warehouse_lead",
  "stakeholder_label": "stakeholder_2",
  "interviewed_at": "2026-06-18T10:00:00Z",
  "interviewer": "consultant_a",
  "topics_covered": ["counting process", "adjustments", "receiving", "system usage"],
  "stated_pain_points": [
    {
      "description": "Counts rarely match the ERP, and there is no time to investigate why",
      "evidence_references": ["evid_alpha_002"]
    }
  ],
  "process_claims": [
    {
      "claim": "Cycle counts are done weekly but only on a subset of aisles chosen informally",
      "workflow_area": "cycle_count",
      "evidence_references": ["evid_alpha_002"]
    },
    {
      "claim": "Received goods are sometimes put away before being booked into the ERP",
      "workflow_area": "receiving",
      "evidence_references": []
    }
  ],
  "system_claims": [
    {
      "claim": "The ERP does not flag negative on-hand balances, so they go unnoticed",
      "system_name": "ERP",
      "evidence_references": []
    }
  ],
  "quantified_impacts": [
    {
      "description": "Time spent reconciling counts each week",
      "metric": "hours_per_week",
      "reported_value": "6-8",
      "unit": "hours",
      "evidence_references": ["evid_alpha_002"]
    }
  ],
  "contradictions_or_followups": [
    {
      "description": "Operations manager stated counts are full-warehouse monthly; warehouse lead describes partial weekly. Reconcile the actual counting cadence.",
      "type": "contradiction"
    },
    {
      "description": "Obtain the adjustment log to quantify unreviewed adjustments.",
      "type": "follow_up"
    }
  ],
  "evidence_references": ["evid_alpha_002"],
  "consultant_notes": "Credible, hands-on account. Prioritize getting the adjustment log to corroborate."
}
